{
  "schema_version": "1.0",
  "id": "spathi_efficiency_development_v1",
  "status": "predeclared",
  "timing": "after_calibration_before_efficiency_validation",
  "purpose": "Select exactly one target-eligibility, adaptive-tree and combined finalist from a finite grid without accessing efficiency-validation or external-test outcomes.",
  "selection_rule": {
    "primary_accuracy_metric": "aupr",
    "level": "directed",
    "aggregation": "equal_simulator_equal_condition_equal_dataset",
    "maximum_mean_absolute_aupr_loss": 0.004,
    "required_completion_fraction": 1.0,
    "requires_observed_speedup": true,
    "cost_estimand": "hierarchical_geometric_mean_candidate_over_reference_wall_time_ratio",
    "decision": "minimum_cost_ratio_then_candidate_id_among_accuracy_eligible_per_component",
    "failure_policy": "A component with no completely observed candidate inside both the accuracy guardrail and the observed-speedup guardrail produces no finalist and is omitted from independent validation. Missing or failed executions are never imputed. If no component has a finalist, independent validation becomes a reference-only execution audit: no non-inferiority comparison or multiplicity adjustment is computed, the exact calibrated reference is frozen, and downstream comparison may continue."
  },
  "budgets": {
    "reduced": {
      "analysis_role": "descriptive",
      "profile": "efficiency-development-reduced",
      "dataset_role": "efficiency_development",
      "split_id": "efficiency_development_reduced_v1",
      "algorithm_seeds": [1923417218, 11282199],
      "execution_order_seed": 370771032,
      "expected_independent_datasets": 5,
      "replicates_per_stratum": 1,
      "authorizes_validation": "descriptive_only"
    },
    "full": {
      "analysis_role": "selection",
      "profile": "efficiency-development-full",
      "dataset_role": "efficiency_development",
      "split_id": "efficiency_development_full_v1",
      "algorithm_seeds": [1837370612, 448704002, 1701696258],
      "execution_order_seed": 923164876,
      "expected_independent_datasets": 15,
      "replicates_per_stratum": 3,
      "authorizes_validation": "confirmatory"
    }
  },
  "candidates": [
    {
      "id": "eligibility_min10_detect005_weight005_ess5",
      "component": "target_eligibility",
      "execution_overrides": {"target_eligibility": "automatic", "min_target_detected_cells": 10, "min_target_detected_fraction": 0.005, "min_target_weighted_detected_fraction": 0.005, "min_target_weighted_detected_ess": 5.0}
    },
    {
      "id": "eligible_targets_detect1pct_min20_wdetect1pct_ess10",
      "component": "target_eligibility",
      "execution_overrides": {"target_eligibility": "automatic", "min_target_detected_cells": 20, "min_target_detected_fraction": 0.01, "min_target_weighted_detected_fraction": 0.01, "min_target_weighted_detected_ess": 10.0}
    },
    {
      "id": "eligibility_min50_detect02_weight02_ess20",
      "component": "target_eligibility",
      "execution_overrides": {"target_eligibility": "automatic", "min_target_detected_cells": 50, "min_target_detected_fraction": 0.02, "min_target_weighted_detected_fraction": 0.02, "min_target_weighted_detected_ess": 20.0}
    },
    {
      "id": "adaptive_min200_step25_tol005_patience3",
      "component": "adaptive_trees",
      "execution_overrides": {"adaptive_trees": true, "adaptive_min_estimators": 200, "adaptive_tree_step": 25, "adaptive_tolerance": 0.005, "adaptive_patience": 3}
    },
    {
      "id": "adaptive_trees_min100_step50_tol01_patience2",
      "component": "adaptive_trees",
      "execution_overrides": {"adaptive_trees": true, "adaptive_min_estimators": 100, "adaptive_tree_step": 50, "adaptive_tolerance": 0.01, "adaptive_patience": 2}
    },
    {
      "id": "adaptive_min100_step100_tol02_patience2",
      "component": "adaptive_trees",
      "execution_overrides": {"adaptive_trees": true, "adaptive_min_estimators": 100, "adaptive_tree_step": 100, "adaptive_tolerance": 0.02, "adaptive_patience": 2}
    },
    {
      "id": "combined_conservative",
      "component": "combined",
      "execution_overrides": {"target_eligibility": "automatic", "min_target_detected_cells": 10, "min_target_detected_fraction": 0.005, "min_target_weighted_detected_fraction": 0.005, "min_target_weighted_detected_ess": 5.0, "adaptive_trees": true, "adaptive_min_estimators": 200, "adaptive_tree_step": 25, "adaptive_tolerance": 0.005, "adaptive_patience": 3}
    },
    {
      "id": "eligible_targets_detect1pct_min20_wdetect1pct_ess10_adaptive_trees",
      "component": "combined",
      "execution_overrides": {"target_eligibility": "automatic", "min_target_detected_cells": 20, "min_target_detected_fraction": 0.01, "min_target_weighted_detected_fraction": 0.01, "min_target_weighted_detected_ess": 10.0, "adaptive_trees": true, "adaptive_min_estimators": 100, "adaptive_tree_step": 50, "adaptive_tolerance": 0.01, "adaptive_patience": 2}
    },
    {
      "id": "combined_aggressive",
      "component": "combined",
      "execution_overrides": {"target_eligibility": "automatic", "min_target_detected_cells": 50, "min_target_detected_fraction": 0.02, "min_target_weighted_detected_fraction": 0.02, "min_target_weighted_detected_ess": 20.0, "adaptive_trees": true, "adaptive_min_estimators": 100, "adaptive_tree_step": 100, "adaptive_tolerance": 0.02, "adaptive_patience": 2}
    }
  ]
}
